{
  "assets": {},
  "body": [
    {
      "content": [
        {
          "text": "Bảng hành trình",
          "type": "text"
        }
      ],
      "level": 1,
      "type": "heading"
    },
    {
      "body": [
        [
          {
            "blocks": [
              {
                "content": [
                  {
                    "text": "Bến sông",
                    "type": "text"
                  }
                ],
                "type": "paragraph"
              }
            ],
            "colspan": 1,
            "rowspan": 1
          },
          {
            "blocks": [
              {
                "content": [
                  {
                    "text": "8",
                    "type": "text"
                  }
                ],
                "type": "paragraph"
              }
            ],
            "colspan": 1,
            "rowspan": 1
          },
          {
            "blocks": [
              {
                "content": [
                  {
                    "text": "Bóng mát",
                    "type": "text"
                  }
                ],
                "type": "paragraph"
              }
            ],
            "colspan": 1,
            "rowspan": 1
          }
        ],
        [
          {
            "blocks": [
              {
                "content": [
                  {
                    "text": "Vườn sách",
                    "type": "text"
                  }
                ],
                "type": "paragraph"
              }
            ],
            "colspan": 1,
            "rowspan": 1
          },
          {
            "blocks": [
              {
                "content": [
                  {
                    "text": "14",
                    "type": "text"
                  }
                ],
                "type": "paragraph"
              }
            ],
            "colspan": 1,
            "rowspan": 1
          },
          {
            "blocks": [
              {
                "content": [
                  {
                    "text": "Có ghế dài",
                    "type": "text"
                  }
                ],
                "type": "paragraph"
              }
            ],
            "colspan": 1,
            "rowspan": 1
          }
        ]
      ],
      "caption": null,
      "columns": [
        {
          "align": "left"
        },
        {
          "align": "right"
        },
        {
          "align": "left"
        }
      ],
      "head": [
        [
          {
            "blocks": [
              {
                "content": [
                  {
                    "text": "Điểm dừng",
                    "type": "text"
                  }
                ],
                "type": "paragraph"
              }
            ],
            "colspan": 1,
            "rowspan": 1
          },
          {
            "blocks": [
              {
                "content": [
                  {
                    "text": "Phút đi bộ",
                    "type": "text"
                  }
                ],
                "type": "paragraph"
              }
            ],
            "colspan": 1,
            "rowspan": 1
          },
          {
            "blocks": [
              {
                "content": [
                  {
                    "text": "Ghi chú",
                    "type": "text"
                  }
                ],
                "type": "paragraph"
              }
            ],
            "colspan": 1,
            "rowspan": 1
          }
        ]
      ],
      "type": "table"
    }
  ],
  "layout": null,
  "meta": {
    "authors": [],
    "date": null,
    "keywords": [],
    "language": null,
    "source_format": "markdown",
    "subject": null,
    "title": null
  },
  "provenance": null,
  "version": "ariad-ir/0"
}