{
  "assets": {},
  "body": [
    {
      "content": [
        {
          "text": "Lịch chăm vườn đọc",
          "type": "text"
        }
      ],
      "level": 1,
      "type": "heading"
    },
    {
      "content": [
        {
          "text": "Khu vườn đọc sách nằm sau thư viện phường, nơi trước đây chỉ có một khoảng sân trống. Các cô thủ thư xin hạt giống từ trường tiểu học, còn bác thợ mộc đóng ba chiếc ghế dài bằng gỗ tái sử dụng.",
          "type": "text"
        }
      ],
      "type": "paragraph"
    },
    {
      "content": [
        {
          "text": "Mỗi sáng thứ bảy, một nhóm hàng xóm tưới cây và đổi sách. Trẻ nhỏ chọn truyện tranh; người lớn mang đến sách nấu ăn, bản đồ cũ và tạp chí khoa học. Những quyển sách được bọc giấy nâu để mưa không làm cong góc.",
          "type": "text"
        }
      ],
      "type": "paragraph"
    }
  ],
  "layout": null,
  "meta": {
    "authors": [],
    "date": null,
    "keywords": [],
    "language": "vi",
    "source_format": "html",
    "subject": null,
    "title": "Lịch chăm vườn đọc"
  },
  "provenance": null,
  "version": "ariad-ir/0"
}